{
  "id": "MURU-1071",
  "category": "adversarial_ambiguity",
  "difficulty": 4,
  "stem": "A soil test correctly detects contamination in 92% of the samples that are genuinely contaminated. The test also has a specificity of 95% (correctly identifying negatives). A colleague presents this data and concludes: 'Since the test is 92% accurate, when it flags someone, there's a 92% chance they're actually contaminated.' The base rate of samples from actually contaminated sites in this soil samples pool is estimated between 0.70% and 2.90%. Is your colleague's reasoning correct? What is the actual probability that a flagged soil sample is truly contaminated? How does the uncertain base rate affect your answer?",
  "uncertainty_type": "structural_uncertainty",
  "required_framework": "bayesian_inference",
  "ground_truth": {
    "answer": "The colleague is wrong — this is the base rate fallacy. P(contaminated | flagged) ranges from 0.115 to 0.355 (NOT 92%). The vast majority of flagged cases are false positives because the base rate is so low. Point estimate at 1.80%: 0.252.",
    "point_estimate": 0.252,
    "confidence_interval": [
      0.115,
      0.355
    ],
    "ci_level": 0.9
  },
  "solution_steps": [
    "The colleague confuses P(flagged | contaminated) = 0.92 with P(contaminated | flagged).",
    "Apply Bayes' theorem: PPV = sensitivity × base_rate / (sensitivity × base_rate + (1-specificity) × (1-base_rate)).",
    "At base rate 1.80%: PPV = 0.92×0.018 / (0.92×0.018 + 0.05×0.982) ≈ 0.252.",
    "At base rate 0.70%: PPV ≈ 0.115.",
    "At base rate 2.90%: PPV ≈ 0.355.",
    "The true PPV (0.252) is dramatically lower than the naive estimate (0.92) because when the base rate is low, false positives dominate."
  ],
  "common_failure_modes": [
    "Agreeing with the colleague that the probability is 92% (the base rate fallacy)",
    "Confusing test accuracy (sensitivity) with positive predictive value (PPV)",
    "Not recognizing that low base rates make most positive flags false positives",
    "Providing a single PPV without accounting for uncertainty in the base rate"
  ],
  "metadata": {
    "author": "generator_base_rate_trap",
    "reviewed": false,
    "source_inspiration": "original",
    "errata": {
      "version": "v1.1",
      "replaces": "v1.0",
      "defects": [
        "D2"
      ]
    }
  }
}
