{
  "id": "MURU-1617",
  "category": "adversarial_ambiguity",
  "difficulty": 4,
  "stem": "A company's employee screening test correctly identifies 95% of the high performers it evaluates. The test also has a specificity of 84% (correctly identifying negatives). A colleague presents this data and concludes: 'Since the test is 95% accurate, when it flags someone, there's a 95% chance they're actually a high performer.' The base rate of high performers among applicants in this job applicants pool is estimated between 0.70% and 3.30%. Is your colleague's reasoning correct? What is the actual probability that a flagged job applicant is truly a high performer? How does the uncertain base rate affect your answer?",
  "uncertainty_type": "structural_uncertainty",
  "required_framework": "bayesian_inference",
  "ground_truth": {
    "answer": "The colleague is wrong — this is the base rate fallacy. P(a high performer | flagged) ranges from 0.0402 to 0.168 (NOT 95%). The vast majority of flagged cases are false positives because the base rate is so low. Point estimate at 2.00%: 0.108.",
    "point_estimate": 0.108,
    "confidence_interval": [
      0.0402,
      0.168
    ],
    "ci_level": 0.9
  },
  "solution_steps": [
    "The colleague confuses P(flagged | a high performer) = 0.95 with P(a high performer | flagged).",
    "Apply Bayes' theorem: PPV = sensitivity × base_rate / (sensitivity × base_rate + (1-specificity) × (1-base_rate)).",
    "At base rate 2.00%: PPV = 0.95×0.02 / (0.95×0.02 + 0.16×0.98) ≈ 0.108.",
    "At base rate 0.70%: PPV ≈ 0.0402.",
    "At base rate 3.30%: PPV ≈ 0.168.",
    "The true PPV (0.108) is dramatically lower than the naive estimate (0.95) because when the base rate is low, false positives dominate."
  ],
  "common_failure_modes": [
    "Agreeing with the colleague that the probability is 95% (the base rate fallacy)",
    "Confusing test accuracy (sensitivity) with positive predictive value (PPV)",
    "Not recognizing that low base rates make most positive flags false positives",
    "Providing a single PPV without accounting for uncertainty in the base rate"
  ],
  "metadata": {
    "author": "generator_base_rate_trap",
    "reviewed": false,
    "source_inspiration": "original",
    "errata": {
      "version": "v1.1",
      "replaces": "v1.0",
      "defects": [
        "D2"
      ]
    }
  }
}
