{
  "id": "MURU-0576",
  "category": "adversarial_ambiguity",
  "difficulty": 4,
  "stem": "An airport security scanner correctly detects 91% of the prohibited items that pass through it. The test also has a specificity of 97% (correctly identifying negatives). A colleague presents this data and concludes: 'Since the test is 91% accurate, when it flags someone, there's a 91% chance they're actually carrying a prohibited item.' The base rate of passengers actually carrying prohibited items in this passengers pool is estimated between 0.90% and 3.10%. Is your colleague's reasoning correct? What is the actual probability that a flagged passenger is truly carrying a prohibited item? How does the uncertain base rate affect your answer?",
  "uncertainty_type": "structural_uncertainty",
  "required_framework": "bayesian_inference",
  "ground_truth": {
    "answer": "The colleague is wrong — this is the base rate fallacy. P(carrying a prohibited item | flagged) ranges from 0.216 to 0.492 (NOT 91%). The vast majority of flagged cases are false positives because the base rate is so low. Point estimate at 2.00%: 0.382.",
    "point_estimate": 0.382,
    "confidence_interval": [
      0.216,
      0.492
    ],
    "ci_level": 0.9
  },
  "solution_steps": [
    "The colleague confuses P(flagged | carrying a prohibited item) = 0.91 with P(carrying a prohibited item | flagged).",
    "Apply Bayes' theorem: PPV = sensitivity × base_rate / (sensitivity × base_rate + (1-specificity) × (1-base_rate)).",
    "At base rate 2.00%: PPV = 0.91×0.02 / (0.91×0.02 + 0.03×0.98) ≈ 0.382.",
    "At base rate 0.90%: PPV ≈ 0.216.",
    "At base rate 3.10%: PPV ≈ 0.492.",
    "The true PPV (0.382) is dramatically lower than the naive estimate (0.91) because when the base rate is low, false positives dominate."
  ],
  "common_failure_modes": [
    "Agreeing with the colleague that the probability is 91% (the base rate fallacy)",
    "Confusing test accuracy (sensitivity) with positive predictive value (PPV)",
    "Not recognizing that low base rates make most positive flags false positives",
    "Providing a single PPV without accounting for uncertainty in the base rate"
  ],
  "metadata": {
    "author": "generator_base_rate_trap",
    "reviewed": false,
    "source_inspiration": "original",
    "errata": {
      "version": "v1.1",
      "replaces": "v1.0",
      "defects": [
        "D2"
      ]
    }
  }
}
