{
  "id": "MURU-2006",
  "category": "adversarial_ambiguity",
  "difficulty": 3,
  "stem": "In a university admissions study comparing Department A vs. Department B: Overall, Treatment Y has a higher acceptance rate (60.8% vs 55.0%). However, when stratified by applicant pool competitiveness: In less competitive applicants (n_X=20, n_Y=100): Treatment X achieves 76% vs Treatment Y's 69%. In highly competitive applicants (n_X=100, n_Y=30): Treatment X achieves 51% vs Treatment Y's 33%. The true population proportion of less competitive applicants is uncertain, estimated between 35% and 52%. Which treatment is actually better, and by how much? Report the adjusted difference in acceptance rate (X - Y) as a proportion to three decimal places.",
  "uncertainty_type": "structural_uncertainty",
  "required_framework": "bayesian_inference",
  "ground_truth": {
    "answer": "This is Simpson's Paradox. Treatment X is better in BOTH subgroups. The aggregate reversal occurs because X is disproportionately applied to highly competitive applicants (harder cases). Adjusted difference (X - Y): [0.123, 0.141], point estimate: 0.132. Treatment X is genuinely better by 13.2 percentage points.",
    "point_estimate": 0.132,
    "confidence_interval": [
      0.123,
      0.141
    ],
    "ci_level": 0.9
  },
  "solution_steps": [
    "Aggregate rates: X=55.0%, Y=60.8% (Y appears better).",
    "Stratified: In less competitive applicants: X=76% > Y=69%. In highly competitive applicants: X=51% > Y=33%.",
    "X is better in BOTH subgroups — this is Simpson's Paradox.",
    "The paradox arises because Department A is applied more to highly competitive applicants (lower baseline rate), skewing the aggregate.",
    "Population-adjusted rate for X: w_A×0.76 + (1-w_A)×0.51.",
    "Population-adjusted rate for Y: w_A×0.69 + (1-w_A)×0.33.",
    "Difference X-Y at w_A=0.43: 0.132. Range: [0.123, 0.141]."
  ],
  "common_failure_modes": [
    "Using the aggregate rates and concluding Treatment Y is better",
    "Not recognizing Simpson's Paradox despite seeing reversed trends in subgroups",
    "Ignoring the confounding variable (unequal group composition between treatments)",
    "Computing adjusted rates with a single population weight without uncertainty"
  ],
  "metadata": {
    "author": "generator_simpsons_paradox",
    "reviewed": false,
    "source_inspiration": "original",
    "errata": {
      "version": "v1.1",
      "replaces": "v1.0",
      "defects": [
        "D3"
      ]
    }
  }
}
