{
  "id": "MURU-1124",
  "category": "adversarial_ambiguity",
  "difficulty": 5,
  "stem": "In an advertising study comparing Platform A vs. Platform B: Overall, Treatment Y has a higher conversion rate (63.6% vs 62.1%). However, when stratified by product category: In low-consideration products (n_X=40, n_Y=80): Treatment X achieves 88% vs Treatment Y's 69%. In high-consideration products (n_X=100, n_Y=30): Treatment X achieves 52% vs Treatment Y's 48%. The true population proportion of low-consideration products is uncertain, estimated between 33% and 51%. Which treatment is actually better, and by how much? Report the adjusted difference in conversion rate (X - Y) as a proportion to three decimal places.",
  "uncertainty_type": "structural_uncertainty",
  "required_framework": "bayesian_inference",
  "ground_truth": {
    "answer": "This is Simpson's Paradox. Treatment X is better in BOTH subgroups. The aggregate reversal occurs because X is disproportionately applied to high-consideration products (harder cases). Adjusted difference (X - Y): [0.09, 0.117], point estimate: 0.103. Treatment X is genuinely better by 10.3 percentage points.",
    "point_estimate": 0.103,
    "confidence_interval": [
      0.09,
      0.117
    ],
    "ci_level": 0.9
  },
  "solution_steps": [
    "Aggregate rates: X=62.1%, Y=63.6% (Y appears better).",
    "Stratified: In low-consideration products: X=88% > Y=69%. In high-consideration products: X=52% > Y=48%.",
    "X is better in BOTH subgroups — this is Simpson's Paradox.",
    "The paradox arises because Platform A is applied more to high-consideration products (lower baseline rate), skewing the aggregate.",
    "Population-adjusted rate for X: w_A×0.88 + (1-w_A)×0.52.",
    "Population-adjusted rate for Y: w_A×0.69 + (1-w_A)×0.48.",
    "Difference X-Y at w_A=0.42: 0.103. Range: [0.09, 0.117]."
  ],
  "common_failure_modes": [
    "Using the aggregate rates and concluding Treatment Y is better",
    "Not recognizing Simpson's Paradox despite seeing reversed trends in subgroups",
    "Ignoring the confounding variable (unequal group composition between treatments)",
    "Computing adjusted rates with a single population weight without uncertainty",
    "Not considering that additional unobserved confounders could further modify the comparison"
  ],
  "metadata": {
    "author": "generator_simpsons_paradox",
    "reviewed": false,
    "source_inspiration": "original",
    "errata": {
      "version": "v1.1",
      "replaces": "v1.0",
      "defects": [
        "D3"
      ]
    }
  }
}
