{
  "id": "MURU-0606",
  "category": "distribution_estimation",
  "difficulty": 3,
  "stem": "An industrial engineering study measures the assembly time (seconds) for a sample of 25 factory workers. The sample mean is 116.0 sec with a sample standard deviation of 40.3 sec. However, 3 of the 25 observations appear to be outliers (values more than 2.5 standard deviations from the mean). If these outliers are removed, the remaining 22 observations have a mean of 110.5 sec and standard deviation of 28.9 sec. Estimate the true population mean and provide a 95% confidence interval that accounts for the uncertainty about whether outliers should be included.",
  "uncertainty_type": "data_uncertainty",
  "required_framework": "frequentist_inference",
  "ground_truth": {
    "answer": "With all data: mean = 116.0, 95% CI = [99.4, 132.6]. Without outliers: mean = 110.5, 95% CI = [98.2, 122.8]. Combined interval accounting for analytic uncertainty: [98.2, 132.6]. Point estimate: 113.2 sec.",
    "point_estimate": 113.2,
    "confidence_interval": [
      98.2,
      132.6
    ],
    "ci_level": 0.95
  },
  "solution_steps": [
    "With full sample (n=25): SE = 40.3/√25 = 8.06. Margin = t(24,0.025) × 8.06 = 2.064 × 8.06 ≈ 16.64.",
    "Full sample 95% CI: 116.0 ± 16.64 = [99.4, 132.6].",
    "With trimmed sample (n=22): SE = 28.9/√22 = 6.16. Margin = 2.0 × 6.16 ≈ 12.32.",
    "Trimmed 95% CI: 110.5 ± 12.32 = [98.2, 122.8].",
    "The outlier treatment choice creates structural uncertainty. Combined interval: [98.2, 132.6]."
  ],
  "common_failure_modes": [
    "Using only the full sample without considering outlier impact",
    "Removing outliers without reporting both analyses",
    "Not recognizing that the choice of analysis method is itself a source of uncertainty"
  ],
  "metadata": {
    "author": "generator_sample_mean",
    "reviewed": false,
    "source_inspiration": "original",
    "errata": {
      "version": "v1.1",
      "replaces": "v1.0",
      "defects": [
        "D1"
      ]
    }
  }
}
