{
  "id": "MURU-1008",
  "category": "adversarial_ambiguity",
  "difficulty": 4,
  "stem": "A fraud detection algorithm correctly identifies 89% of the transactions that are genuinely fraudulent. The test also has a specificity of 82% (correctly identifying negatives). A colleague presents this data and concludes: 'Since the test is 89% accurate, when it flags someone, there's a 89% chance they're actually fraudulent.' The base rate of transactions that are actually fraudulent in this credit card transactions pool is estimated between 0.20% and 0.90%. Is your colleague's reasoning correct? What is the actual probability that a flagged credit card transaction is truly fraudulent? How does the uncertain base rate affect your answer?",
  "uncertainty_type": "structural_uncertainty",
  "required_framework": "bayesian_inference",
  "ground_truth": {
    "answer": "The colleague is wrong — this is the base rate fallacy. P(fraudulent | flagged) ranges from 0.00981 to 0.043 (NOT 89%). The vast majority of flagged cases are false positives because the base rate is so low. Point estimate at 0.50%: 0.0242.",
    "point_estimate": 0.0242,
    "confidence_interval": [
      0.00981,
      0.043
    ],
    "ci_level": 0.9
  },
  "solution_steps": [
    "The colleague confuses P(flagged | fraudulent) = 0.89 with P(fraudulent | flagged).",
    "Apply Bayes' theorem: PPV = sensitivity × base_rate / (sensitivity × base_rate + (1-specificity) × (1-base_rate)).",
    "At base rate 0.50%: PPV = 0.89×0.005 / (0.89×0.005 + 0.18×0.995) ≈ 0.0242.",
    "At base rate 0.20%: PPV ≈ 0.00981.",
    "At base rate 0.90%: PPV ≈ 0.043.",
    "The true PPV (0.0242) is dramatically lower than the naive estimate (0.89) because when the base rate is low, false positives dominate."
  ],
  "common_failure_modes": [
    "Agreeing with the colleague that the probability is 89% (the base rate fallacy)",
    "Confusing test accuracy (sensitivity) with positive predictive value (PPV)",
    "Not recognizing that low base rates make most positive flags false positives",
    "Providing a single PPV without accounting for uncertainty in the base rate"
  ],
  "metadata": {
    "author": "generator_base_rate_trap",
    "reviewed": false,
    "source_inspiration": "original",
    "errata": {
      "version": "v1.1",
      "replaces": "v1.0",
      "defects": [
        "D2"
      ]
    }
  }
}
