{
  "id": "MURU-2266",
  "category": "distribution_estimation",
  "difficulty": 1,
  "stem": "A food manufacturing study measures the weight (grams) for a sample of 25 cereal boxes. The sample mean is 539.2 g with a sample standard deviation of 53.9 g. Assuming the data are approximately normally distributed, estimate the true population mean and provide a 95% confidence interval.",
  "uncertainty_type": "data_uncertainty",
  "required_framework": "frequentist_inference",
  "ground_truth": {
    "answer": "Population mean ≈ 539.2 g. 95% CI = [517.0, 561.5]. Point estimate: 539.2 g.",
    "point_estimate": 539.2,
    "confidence_interval": [
      517.0,
      561.5
    ],
    "ci_level": 0.95
  },
  "solution_steps": [
    "Standard error: SE = s/√n = 53.9/√25 = 10.78.",
    "Degrees of freedom: df = 25 - 1 = 24.",
    "t-critical value: t(24, 0.025) ≈ 2.064.",
    "Margin of error: 2.064 × 10.78 = 22.25.",
    "95% CI: 539.2 ± 22.25 = [517.0, 561.5]."
  ],
  "common_failure_modes": [
    "Using z-critical value instead of t-critical for small samples",
    "Computing SE as 53.9/n instead of 53.9/√n",
    "Not reporting the confidence interval alongside the point estimate"
  ],
  "metadata": {
    "author": "generator_sample_mean",
    "reviewed": false,
    "source_inspiration": "original",
    "errata": {
      "version": "v1.1",
      "replaces": "v1.0",
      "defects": [
        "D1"
      ]
    }
  }
}
