{
  "id": "MURU-2182",
  "category": "distribution_estimation",
  "difficulty": 2,
  "stem": "A web performance study measures the response time (ms) for a sample of 30 website users. The sample mean is 493.7 ms with a sample standard deviation of 146.4 ms. Assuming the data are approximately normally distributed, estimate the true population mean and provide a 95% confidence interval.",
  "uncertainty_type": "data_uncertainty",
  "required_framework": "frequentist_inference",
  "ground_truth": {
    "answer": "Population mean ≈ 493.7 ms. 95% CI = [439.0, 548.4]. Point estimate: 493.7 ms.",
    "point_estimate": 493.7,
    "confidence_interval": [
      439.0,
      548.4
    ],
    "ci_level": 0.95
  },
  "solution_steps": [
    "Standard error: SE = s/√n = 146.4/√30 = 26.73.",
    "Degrees of freedom: df = 30 - 1 = 29.",
    "t-critical value: t(29, 0.025) ≈ 2.045.",
    "Margin of error: 2.045 × 26.73 = 54.66.",
    "95% CI: 493.7 ± 54.66 = [439.0, 548.4]."
  ],
  "common_failure_modes": [
    "Using z-critical value instead of t-critical for small samples",
    "Computing SE as 146.4/n instead of 146.4/√n",
    "Not reporting the confidence interval alongside the point estimate"
  ],
  "metadata": {
    "author": "generator_sample_mean",
    "reviewed": false,
    "source_inspiration": "original",
    "errata": {
      "version": "v1.1",
      "replaces": "v1.0",
      "defects": [
        "D1"
      ]
    }
  }
}
