{
  "id": "MURU-2350",
  "category": "distribution_estimation",
  "difficulty": 1,
  "stem": "A network performance study measures the download speed (Mbps) for a sample of 40 subscribers. The sample mean is 388.8 Mbps with a sample standard deviation of 106.0 Mbps. Assuming the data are approximately normally distributed, estimate the true population mean and provide a 95% confidence interval.",
  "uncertainty_type": "data_uncertainty",
  "required_framework": "frequentist_inference",
  "ground_truth": {
    "answer": "Population mean ≈ 388.8 Mbps. 95% CI = [354.9, 422.7]. Point estimate: 388.8 Mbps.",
    "point_estimate": 388.8,
    "confidence_interval": [
      354.9,
      422.7
    ],
    "ci_level": 0.95
  },
  "solution_steps": [
    "Standard error: SE = s/√n = 106.0/√40 = 16.76.",
    "Degrees of freedom: df = 40 - 1 = 39.",
    "t-critical value: t(39, 0.025) ≈ 2.023.",
    "Margin of error: 2.023 × 16.76 = 33.91.",
    "95% CI: 388.8 ± 33.91 = [354.9, 422.7]."
  ],
  "common_failure_modes": [
    "Using z-critical value instead of t-critical for small samples",
    "Computing SE as 106.0/n instead of 106.0/√n",
    "Not reporting the confidence interval alongside the point estimate"
  ],
  "metadata": {
    "author": "generator_sample_mean",
    "reviewed": false,
    "source_inspiration": "original",
    "errata": {
      "version": "v1.1",
      "replaces": "v1.0",
      "defects": [
        "D1"
      ]
    }
  }
}
