{
  "id": "MURU-1174",
  "category": "distribution_estimation",
  "difficulty": 2,
  "stem": "An urban planning study measures the commute time (minutes) for a sample of 20 city workers. The sample mean is 18.2 min with a sample standard deviation of 4.0 min. Assuming the data are approximately normally distributed, estimate the true population mean and provide a 95% confidence interval.",
  "uncertainty_type": "data_uncertainty",
  "required_framework": "frequentist_inference",
  "ground_truth": {
    "answer": "Population mean ≈ 18.2 min. 95% CI = [16.3, 20.1]. Point estimate: 18.2 min.",
    "point_estimate": 18.2,
    "confidence_interval": [
      16.3,
      20.1
    ],
    "ci_level": 0.95
  },
  "solution_steps": [
    "Standard error: SE = s/√n = 4.0/√20 = 0.89.",
    "Degrees of freedom: df = 20 - 1 = 19.",
    "t-critical value: t(19, 0.025) ≈ 2.093.",
    "Margin of error: 2.093 × 0.89 = 1.86.",
    "95% CI: 18.2 ± 1.86 = [16.3, 20.1]."
  ],
  "common_failure_modes": [
    "Using z-critical value instead of t-critical for small samples",
    "Computing SE as 4.0/n instead of 4.0/√n",
    "Not reporting the confidence interval alongside the point estimate"
  ],
  "metadata": {
    "author": "generator_sample_mean",
    "reviewed": false,
    "source_inspiration": "original",
    "errata": {
      "version": "v1.1",
      "replaces": "v1.0",
      "defects": [
        "D1"
      ]
    }
  }
}
